{
  "schemaVersion": 1,
  "componentId": "service-manager",
  "kind": "service-manager",
  "version": "0.2.26",
  "description": "Host-local deployment facade and sequenced runtime observations",
  "connectsToHive": true,
  "requirements": {
    "node": ">=24.18.0 <25.0.0",
    "hiveProtocol": 1,
    "contracts": [],
    "os": [
      "win32",
      "linux"
    ],
    "arch": [
      "x64",
      "arm64"
    ]
  },
  "entrypoint": {
    "executable": "dist/native/ivy-service-manager",
    "args": [],
    "timeoutMs": 30000
  },
  "prepare": [
    {
      "executable": "node",
      "args": [
        "tools/build/build-native-deployment.mjs",
        "--component",
        "service-manager"
      ],
      "timeoutMs": 3600000
    }
  ],
  "checks": [],
  "readiness": {
    "timeoutMs": 30000,
    "command": {
      "executable": "dist/native/ivy-health",
      "args": [],
      "timeoutMs": 5000
    }
  },
  "shutdown": {
    "timeoutMs": 15000
  },
  "restart": {
    "policy": "always",
    "minimumDelayMs": 1000,
    "maximumDelayMs": 60000
  },
  "storage": {
    "minReadableFormat": 1,
    "maxReadableFormat": 1,
    "writeFormat": 1
  },
  "runtimeReset": {
    "delete": [
      {
        "area": "data",
        "path": "health.json"
      },
      {
        "area": "data",
        "path": "control.json"
      },
      {
        "area": "work",
        "path": "."
      },
      {
        "area": "logs",
        "path": "."
      }
    ],
    "preserve": []
  }
}
