{
  "schemaVersion": 1,
  "componentId": "secretary-ui",
  "kind": "app",
  "version": "0.1.35",
  "description": "Static Secretary configuration and execution journal UI",
  "connectsToHive": false,
  "requirements": {
    "node": ">=24.18.0 <25.0.0",
    "hiveProtocol": 1,
    "contracts": []
  },
  "app": {
    "appId": "secretary-ui",
    "dist": "dist/apps/secretary-ui",
    "entryPath": "index.html"
  },
  "prepare": [
    {
      "executable": "node",
      "args": [
        "tools/build/run-npm.mjs",
        "ci"
      ],
      "timeoutMs": 600000
    },
    {
      "executable": "node",
      "args": [
        "tools/build/build-deployment.mjs",
        "--component",
        "secretary-ui"
      ],
      "timeoutMs": 300000
    }
  ],
  "checks": []
}
