{
  "schemaVersion": 1,
  "componentId": "agent-manager",
  "kind": "service",
  "version": "0.4.23",
  "description": "Pinned public native Codex owner, complete projections, inventory and durable outcomes",
  "connectsToHive": true,
  "requirements": {
    "node": ">=24.18.0 <25.0.0",
    "hiveProtocol": 1,
    "contracts": [],
    "os": ["win32", "linux"],
    "arch": ["x64", "arm64"]
  },
  "entrypoint": {
    "executable": "dist/native/ivy-agent-manager",
    "args": [],
    "timeoutMs": 30000
  },
  "prepare": [
    {
      "executable": "node",
      "args": [
        "tools/build/build-native-deployment.mjs",
        "--component",
        "agent-manager"
      ],
      "timeoutMs": 3600000
    }
  ],
  "checks": [],
  "readiness": {
    "timeoutMs": 180000,
    "command": {
      "executable": "dist/native/ivy-health",
      "args": [],
      "timeoutMs": 5000
    }
  },
  "shutdown": {
    "timeoutMs": 15000
  },
  "restart": {
    "policy": "always",
    "minimumDelayMs": 1000,
    "maximumDelayMs": 60000
  },
  "runtimeReset": {
    "delete": [
      {
        "area": "data",
        "path": "journal"
      },
      {
        "area": "data",
        "path": "project-locations.sqlite"
      },
      {
        "area": "data",
        "path": "project-locations.sqlite-wal"
      },
      {
        "area": "data",
        "path": "project-locations.sqlite-shm"
      },
      {
        "area": "data",
        "path": "project-backup-paths.json"
      },
      {
        "area": "data",
        "path": "process-stop-fence.json"
      },
      {
        "area": "data",
        "path": "owned-process-stops.json"
      },
      {
        "area": "data",
        "path": "runtime-reset.json"
      },
      {
        "area": "data",
        "path": "runtime-reset-applied.json"
      },
      {
        "area": "data",
        "path": "health.json"
      },
      {
        "area": "data",
        "path": "control.json"
      },
      {
        "area": "work",
        "path": "."
      },
      {
        "area": "logs",
        "path": "."
      }
    ],
    "preserve": [],
    "completionMarker": "runtime-reset.json"
  }
}
