{
  "schemaVersion": 1,
  "componentId": "task-board",
  "kind": "service",
  "version": "0.3.32",
  "description": "Durable task actions, retained native Run reconciliation and fair scheduling",
  "connectsToHive": true,
  "requirements": {
    "node": ">=24.18.0 <25.0.0",
    "hiveProtocol": 1,
    "nativeCatalogs": true,
    "contracts": []
  },
  "entrypoint": {
    "executable": "node",
    "args": [
      "dist/services/task-board/src/main.js"
    ],
    "timeoutMs": 30000
  },
  "prepare": [
    {
      "executable": "node",
      "args": [
        "tools/build/run-npm.mjs",
        "ci"
      ],
      "timeoutMs": 600000
    },
    {
      "executable": "node",
      "args": [
        "--max-old-space-size=448",
        "tools/build/build-deployment.mjs",
        "--component",
        "task-board"
      ],
      "timeoutMs": 300000
    }
  ],
  "checks": [],
  "readiness": {
    "timeoutMs": 30000,
    "command": {
      "executable": "node",
      "args": [
        "dist/packages/host-runtime/src/health.js"
      ],
      "timeoutMs": 5000
    }
  },
  "shutdown": {
    "timeoutMs": 15000
  },
  "restart": {
    "policy": "always",
    "minimumDelayMs": 1000,
    "maximumDelayMs": 60000
  },
  "storage": {
    "minReadableFormat": 1,
    "maxReadableFormat": 1,
    "writeFormat": 1
  },
  "runtimeReset": {
    "delete": [
      {
        "area": "data",
        "path": "task-board.sqlite"
      },
      {
        "area": "data",
        "path": "task-board.sqlite-wal"
      },
      {
        "area": "data",
        "path": "task-board.sqlite-shm"
      },
      {
        "area": "data",
        "path": "artifact-cleanup.json"
      },
      {
        "area": "data",
        "path": "artifact-cleanup-plan.json"
      },
      {
        "area": "data",
        "path": "comment-cleanup.json"
      },
      {
        "area": "data",
        "path": "health.json"
      },
      {
        "area": "data",
        "path": "control.json"
      },
      {
        "area": "work",
        "path": "."
      },
      {
        "area": "logs",
        "path": "."
      }
    ],
    "preserve": []
  }
}
